{
  "uid": "tc2-t1",
  "clase_uid": "tc2",
  "orden": 1,
  "titulo": "Promedio de calificaciones",
  "nivel_apoyo": "ejemplo_resuelto",
  "enunciado_md": "La coordinación necesita el promedio de un grupo. Lee **n** y luego **n** calificaciones; imprime el promedio con dos decimales.",
  "arcs": {
    "atencion": "¿Cuánto tardarías en promediar a mano 300 calificaciones?",
    "relevancia": "Los sistemas escolares procesan listas de datos todos los días.",
    "confianza": "Con la entrada de ejemplo el programa debe imprimir 9.00.",
    "satisfaccion": "En la siguiente tarea usarás este patrón con tus propios datos."
  },
  "lenguaje": "c",
  "codigo_inicial": "#include <stdio.h>\n\nint main(void) {\n    int n;\n    scanf(\"%d\", &n);              /* 1. Leer cuántos datos vienen */\n    double x, suma = 0.0;\n    for (int i = 0; i < n; i++) {  /* 2. Acumular cada calificación */\n        scanf(\"%lf\", &x);\n        suma += x;\n    }\n    printf(\"%.2f\\n\", suma / n);   /* 3. Dividir e imprimir */\n    return 0;\n}\n",
  "solucion": "#include <stdio.h>\n\nint main(void) {\n    int n;\n    scanf(\"%d\", &n);\n    double x, suma = 0.0;\n    for (int i = 0; i < n; i++) {\n        scanf(\"%lf\", &x);\n        suma += x;\n    }\n    printf(\"%.2f\\n\", suma / n);\n    return 0;\n}\n",
  "casos_prueba": [
    { "entrada": "3\n8 9 10\n", "salida_esperada": "9.00\n", "oculto": false },
    { "entrada": "2\n6 7\n", "salida_esperada": "6.50\n", "oculto": true }
  ],
  "pide_autoexplicacion": true,
  "colaborativa": false,
  "diseno": {
    "paso_clt4bp": 5,
    "componente": "tarea",
    "efectos": [
      { "id": "ejemplo_resuelto", "como": "Solución completa con sus tres pasos comentados." },
      { "id": "atencion_dividida", "como": "Cada explicación va junto a su línea." }
    ],
    "interactividad": "media",
    "tiempo_estimado_min": 15,
    "justificacion": "Grupo con poco conocimiento previo: la clase abre con un ejemplo resuelto.",
    "advertencias": []
  }
}
